{
  "schema_version": 1,
  "id": "2026-05-17-q2mb",
  "points": [
    [
      50.8601,
      0.5801,
      0,
      12.0
    ],
    [
      50.8605,
      0.5812,
      85.2,
      null
    ]
  ],
  "trim_ends_m": 200,
  "bbox": [
    50.8601,
    0.5801,
    50.8605,
    0.5812
  ],
  "source": "intervals"
}
